"DESCRIPTION","DURATION IN MS","NAME","PARENT SUITE","START TIME","STATUS","STOP TIME","SUB SUITE","SUITE","TEST CLASS","TEST METHOD"
"","2","Create job opening and verify it appears in the list -- @1.2 ","","Tue Dec 16 14:52:54 UTC 2025","skipped","Tue Dec 16 14:52:54 UTC 2025","","","",""
"","2","Search for specific email","","Tue Dec 16 14:52:54 UTC 2025","skipped","Tue Dec 16 14:52:54 UTC 2025","","","",""
"","1","Login with valid credentials redirects to dashboard","","Tue Dec 16 14:52:54 UTC 2025","skipped","Tue Dec 16 14:52:54 UTC 2025","","","",""
"","1","Fetch latest emails from inbox","","Tue Dec 16 14:52:54 UTC 2025","skipped","Tue Dec 16 14:52:54 UTC 2025","","","",""
"","1","Login with invalid credentials shows error","","Tue Dec 16 14:52:54 UTC 2025","skipped","Tue Dec 16 14:52:54 UTC 2025","","","",""
"","363","Create job opening and verify it appears in the list -- @1.1 ","","Tue Dec 16 14:52:53 UTC 2025","skipped","Tue Dec 16 14:52:54 UTC 2025","","","",""
