"DESCRIPTION","DURATION IN MS","NAME","PARENT SUITE","START TIME","STATUS","STOP TIME","SUB SUITE","SUITE","TEST CLASS","TEST METHOD"
"","2086","Fetch latest emails from inbox","","Thu Dec 18 04:00:38 UTC 2025","passed","Thu Dec 18 04:00:40 UTC 2025","","","",""
"","1926","Login with valid credentials redirects to dashboard","","Thu Dec 18 04:00:43 UTC 2025","passed","Thu Dec 18 04:00:45 UTC 2025","","","",""
"","1363","Login with invalid credentials shows error","","Thu Dec 18 04:00:42 UTC 2025","passed","Thu Dec 18 04:00:43 UTC 2025","","","",""
"","64222","Create job opening and verify it appears in the list ""python_developer"" -- @1.1 ","","Thu Dec 18 03:59:34 UTC 2025","passed","Thu Dec 18 04:00:38 UTC 2025","","","",""
"","1846","Verify interview email can be fetched","","Thu Dec 18 04:00:45 UTC 2025","passed","Thu Dec 18 04:00:47 UTC 2025","","","",""
"","1140","Search for specific email","","Thu Dec 18 04:00:40 UTC 2025","passed","Thu Dec 18 04:00:42 UTC 2025","","","",""
